<?xml version="1.0" encoding="UTF-8"?>


<lawfirm xmlns:xsi="http://www.w3.org/2001/XMLSchema-instance"
         xsi:noNamespaceSchemaLocation="lawfirmjaxb.xsd">

    <lawFirmId>106</lawFirmId>
    <lawFirmName>Norris Persinger</lawFirmName>
    <address>153 Glen Street</address>
    <country>USA</country>
    <city>Washington</city>
    <awardList>
        <award id ="6">
            <awardName>Keane Award</awardName>
        </award>
        <award id ="5">
            <awardName>Smith Award</awardName>
        </award>
    </awardList>
    <attorneyList>
        <attorney id ="1012">
            <attorneyName>Vishnu</attorneyName>
            <country>USA</country>
            <city>cincinnati</city>
            <associationBarIdList>
                <associationBarId>110</associationBarId>
                <associationBarId>115</associationBarId>
                <associationBarId>106</associationBarId>
            </associationBarIdList>
        </attorney>
        <attorney id ="1013">
            <attorneyName>Kadhir</attorneyName>
            <country>USA</country>
            <city>Charlotte</city>
            <associationBarIdList>
                <associationBarId>109</associationBarId>
                <associationBarId>100</associationBarId>
                <associationBarId>106</associationBarId>
            </associationBarIdList>
        </attorney>
        <attorney id ="1014">
            <attorneyName>Kumar</attorneyName>
            <country>USA</country>
            <city>Concord</city>
            <associationBarIdList>
                <associationBarId>111</associationBarId>
                <associationBarId>106</associationBarId>
                <associationBarId>103</associationBarId>
            </associationBarIdList>
        </attorney>
    </attorneyList>
</lawfirm>
